### ISSUE TITLE
Session cookie not unset correctly

### ISSUE THREAD

**Issue by thisisaaronland** [aaronland/go-auth#24]
```
[auth-server] 2020/11/27 08:39:21 MFA HEADER map[Set-Cookie:[s=; Max-Age=0]]
[auth-server] 2020/11/27 08:39:21 MFA signout cookie remove
[auth-server] 2020/11/27 08:39:21 MFA HEADER 2 map[Set-Cookie:[s=; Max-Age=0 m=; Max-Age=0]]
[auth-server] 2020/11/27 08:39:21 Query redirect handler /signout (POST)
[auth-server] 2020/11/27 08:39:21 QUERY REDIRECT HEADER map[Set-Cookie:[s=; Max-Age=0 m=; Max-Age=0]]
Set-Cookie: s=; Max-Age=0
Set-Cookie: m=; Max-Age=0
[auth-server] 2020/11/27 08:39:21 Query redirect to / (POST)
```

In this example only the `m` cookie is unset.

https://tools.ietf.org/html/rfc6265#section-4.1 says:

```
4.1.1.  Syntax

   Informally, the Set-Cookie response header contains the header name
   "Set-Cookie" followed by a ":" and a cookie.  Each cookie begins with
   a name-value-pair, followed by zero or more attribute-value pairs.
   Servers SHOULD NOT send Set-Cookie headers that fail to conform to
   the following grammar:
```

**Comment by thisisaaronland** [comment]
```
[auth-server] 2020/11/27 09:16:23 MFA signout cookie remove
[auth-server] 2020/11/27 09:16:23 MFA HEADER 2 map[Set-Cookie:[s=spork; Path=/; Expires=Mon, 26 Oct 2020 13:16:23 GMT; Max-Age=1603718183; HttpOnly; SameSite m=; Max-Age=0]]
[auth-server] 2020/11/27 09:16:23 Query redirect handler /signout (POST)
[auth-server] 2020/11/27 09:16:23 QUERY REDIRECT HEADER map[Set-Cookie:[s=spork; Path=/; Expires=Mon, 26 Oct 2020 13:16:23 GMT; Max-Age=1603718183; HttpOnly; SameSite m=; Max-Age=0]]
Set-Cookie: s=spork; Path=/; Expires=Mon, 26 Oct 2020 13:16:23 GMT; Max-Age=1603718183; HttpOnly; SameSite
Set-Cookie: m=; Max-Age=0
[auth-server] 2020/11/27 09:16:23 WTF 2
[auth-server] 2020/11/27 09:16:23 Query redirect to / (POST)
[auth-server] 2020/11/27 09:16:23 (127.0.0.1:60897) "POST /signout HTTP/1.1" 303 0 61.21µs
[auth-server] 2020/11/27 09:16:23 (127.0.0.1:60897) "POST /signout HTTP/1.1" 303 0 956.456µs
[auth-server] 2020/11/27 09:16:23 EP Auth handler / (GET)
[auth-server] 2020/11/27 09:16:23 EP Auth handler get account / (GET)
[auth-server] 2020/11/27 09:16:23 EP Auth handler got cookie 's' with ID '{OLD COOKIE/SESSION ID}'
[auth-server] 2020/11/27 09:16:23 EP Auth handler get account return ACCT
[auth-server] 2020/11/27 09:16:23 EP set account context
```

**Comment by thisisaaronland** [comment]
Section 4.1.2 says:

```
If the user agent receives a new cookie with the same cookie-name,
   domain-value, and path-value as a cookie that it has already stored,
   the existing cookie is evicted and replaced with the new cookie.
```

But earlier in the logs there is this:

```
[auth-server] 2020/11/27 09:16:23 EP signout handler POST
2020/11/27 09:16:23 net/http: invalid Cookie.Domain "localhost:8080"; dropping domain attribute
[auth-server] 2020/11/27 09:16:23 EP signout handler remove cookie 's'
2020/11/27 09:16:23 net/http: invalid Cookie.Domain "localhost:8080"; dropping domain attribute
[auth-server] 2020/11/27 09:16:23 EP signout handler go to next, 0x13e6040
[auth-server] 2020/11/27 09:16:23 MFA Signout Handler /signout (POST)
```

But presumably this is moot because the same warning happens when the cookies are set:

```
[auth-server] 2020/11/27 09:21:22 EP is auth: false, <nil>
2020/11/27 09:21:22 net/http: invalid Cookie.Domain "localhost:8080"; dropping domain attribute
2020/11/27 09:21:22 net/http: invalid Cookie.Domain "localhost:8080"; dropping domain attribute
[auth-server] 2020/11/27 09:21:22 Query redirect handler /signin (POST)
[auth-server] 2020/11/27 09:21:22 QUERY REDIRECT HEADER map[Set-Cookie:[s=***; Path=/; Expires=Fri, 27 Nov 2020 22:21:22 GMT; HttpOnly; SameSite]]
Set-Cookie: s=***; Path=/; Expires=Fri, 27 Nov 2020 22:21:22 GMT; HttpOnly; SameSite
```

**Comment by thisisaaronland** [comment]
But, if I unset the `s` cookie when the `m` cookie is unset (as in: the same handler) ... it works:

```
[auth-server] 2020/11/27 09:27:05 MFA Signout Handler /signout (POST)
[auth-server] 2020/11/27 09:27:05 MFA signout cookie m=*** (m)
[auth-server] 2020/11/27 09:27:05 MFA HEADER map[Set-Cookie:[s=spork; Path=/; Expires=Mon, 26 Oct 2020 13:27:05 GMT; Max-Age=1603718825; HttpOnly; SameSite]]
[auth-server] 2020/11/27 09:27:05 MFA signout cookie remove
[auth-server] 2020/11/27 09:27:05 MFA WTF HEADER 2 map[Set-Cookie:[s=spork; Path=/; Expires=Mon, 26 Oct 2020 13:27:05 GMT; Max-Age=1603718825; HttpOnly; SameSite m=; Max-Age=0]]
[auth-server] 2020/11/27 09:27:05 Query redirect handler /signout (POST)
[auth-server] 2020/11/27 09:27:05 QUERY REDIRECT HEADER map[Set-Cookie:[s=spork; Path=/; Expires=Mon, 26 Oct 2020 13:27:05 GMT; Max-Age=1603718825; HttpOnly; SameSite m=; Max-Age=0 s=; Max-Age=0]]
Set-Cookie: s=spork; Path=/; Expires=Mon, 26 Oct 2020 13:27:05 GMT; Max-Age=1603718825; HttpOnly; SameSite
Set-Cookie: m=; Max-Age=0
Set-Cookie: s=; Max-Age=0
[auth-server] 2020/11/27 09:27:05 Query redirect to / (POST)
[auth-server] 2020/11/27 09:27:05 (127.0.0.1:61461) "POST /signout HTTP/1.1" 303 0 60.69µs
[auth-server] 2020/11/27 09:27:05 (127.0.0.1:61461) "POST /signout HTTP/1.1" 303 0 1.243034ms
[auth-server] 2020/11/27 09:27:05 EP Auth handler / (GET)
[auth-server] 2020/11/27 09:27:05 EP Auth handler get account / (GET)
[auth-server] 2020/11/27 09:27:05 EP no account, redirect to /signin
```

But why?

**Comment by thisisaaronland** [comment]
But also: In the scenario above only the `s` cookie is deleted. The `m` cookie persists...

But why?

**Comment by thisisaaronland** [comment]
If cookies to unset are generated by `go-auth/cookie.Config` methods (in order to match the cookies that were set using those methods) then:

* Neither cookie is deleted
* The value of the `m` cookie is correctly set to ""; the value of the `s` cookie is unchanged (contains a session ID)
* The expiry date for the `m` cookie is interpreted by Firefox as being ~50 years in the future even though it should be one month in the past. 

```
[auth-server] 2020/11/27 09:51:15 MFA Signout Handler /signout (POST)
[auth-server] 2020/11/27 09:51:15 MFA signout cookie m=*** (m)
[auth-server] 2020/11/27 09:51:15 MFA HEADER map[Set-Cookie:[s=; Path=/; Expires=Mon, 26 Oct 2020 13:51:15 GMT; Max-Age=1603720275; HttpOnly; SameSite]]
2020/11/27 09:51:15 net/http: invalid Cookie.Domain "localhost:8080"; dropping domain attribute
[auth-server] 2020/11/27 09:51:15 MFA signout cookie remove
2020/11/27 09:51:15 net/http: invalid Cookie.Domain "localhost:8080"; dropping domain attribute
[auth-server] 2020/11/27 09:51:15 MFA HEADER 2 map[Set-Cookie:[s=; Path=/; Expires=Mon, 26 Oct 2020 13:51:15 GMT; Max-Age=1603720275; HttpOnly; SameSite m=; Path=/; Expires=Mon, 26 Oct 2020 13:51:15 GMT; Max-Age=1603720275; HttpOnly; SameSite]]
[auth-server] 2020/11/27 09:51:15 Query redirect handler /signout (POST)
[auth-server] 2020/11/27 09:51:15 QUERY REDIRECT HEADER map[Set-Cookie:[s=; Path=/; Expires=Mon, 26 Oct 2020 13:51:15 GMT; Max-Age=1603720275; HttpOnly; SameSite m=; Path=/; Expires=Mon, 26 Oct 2020 13:51:15 GMT; Max-Age=1603720275; HttpOnly; SameSite]]
Set-Cookie: s=; Path=/; Expires=Mon, 26 Oct 2020 13:51:15 GMT; Max-Age=1603720275; HttpOnly; SameSite
Set-Cookie: m=; Path=/; Expires=Mon, 26 Oct 2020 13:51:15 GMT; Max-Age=1603720275; HttpOnly; SameSite
[auth-server] 2020/11/27 09:51:15 Query redirect to / (POST)
[auth-server] 2020/11/27 09:51:15 (127.0.0.1:62058) "POST /signout HTTP/1.1" 303 0 55.948µs
[auth-server] 2020/11/27 09:51:15 (127.0.0.1:62058) "POST /signout HTTP/1.1" 303 0 998.836µs
[auth-server] 2020/11/27 09:51:15 EP Auth handler / (GET)
[auth-server] 2020/11/27 09:51:15 EP Auth handler get account / (GET)
[auth-server] 2020/11/27 09:51:15 EP Auth handler got cookie 's' with ID '***'
[auth-server] 2020/11/27 09:51:15 EP Auth handler get account return ACCT
[auth-server] 2020/11/27 09:51:15 EP set account context
```

<img width="1126" alt="Screen Shot 2020-11-27 at 09 51 51" src="https://user-images.githubusercontent.com/12658759/100461191-6e60d700-3096-11eb-9736-d47062089540.png">

**Comment by thisisaaronland** [comment]
Investigate: https://github.com/kataras/go-sessions/blob/a5ecb92b616498807bb9ee0905e8e288ea2484c3/cookie.go

**Comment by thisisaaronland** [comment]
All the evidence suggests this is a Go thing, as in even though a call to `rsp.Header().Write(os.Stdout)` will print both headers only the last header (set in `totp.SignoutHandler`) is actually sent across the wire...

```
$> tcpdump -X -i lo0 port 8080

...
09:05:57.473691 IP localhost.http-alt > localhost.49430: Flags [P.], seq 726:887, ack 1544, win 6355, options [nop,nop,TS val 1184948244 ecr 1184948242], length 161: HTTP: HTTP/1.1 303 See Other
	0x0000:  4500 00d5 0000 4000 4006 0000 7f00 0001  E.....@.@.......
	0x0010:  7f00 0001 1f90 c116 4f52 8745 cb51 a367  ........OR.E.Q.g
	0x0020:  8018 18d3 fec9 0000 0101 080a 46a0 e014  ............F...
	0x0030:  46a0 e012 4854 5450 2f31 2e31 2033 3033  F...HTTP/1.1.303
	0x0040:  2053 6565 204f 7468 6572 0d0a 4c6f 6361  .See.Other..Loca
	0x0050:  7469 6f6e 3a20 2f0d 0a53 6574 2d43 6f6f  tion:./..Set-Coo
	0x0060:  6b69 653a 206d 3d3b 2045 7870 6972 6573  kie:.m=;.Expires
	0x0070:  3d57 6564 2c20 3238 204f 6374 2032 3032  =Wed,.28.Oct.202
	0x0080:  3020 3133 3a30 353a 3537 2047 4d54 3b20  0.13:05:57.GMT;.
	0x0090:  4d61 782d 4167 653d 300d 0a44 6174 653a  Max-Age=0..Date:
	0x00a0:  2053 756e 2c20 3239 204e 6f76 2032 3032  .Sun,.29.Nov.202
	0x00b0:  3020 3134 3a30 353a 3537 2047 4d54 0d0a  0.14:05:57.GMT..
	0x00c0:  436f 6e74 656e 742d 4c65 6e67 7468 3a20  Content-Length:.
	0x00d0:  300d 0a0d 0a                             0....
09:05:57.473715 IP localhost.49430 > localhost.http-alt: Flags [.], ack 887, win 6365, options [nop,nop,TS val 1184948244 ecr 1184948244], length 0
	0x0000:  4500 0034 0000 4000 4006 0000 7f00 0001  E..4..@.@.......
	0x0010:  7f00 0001 c116 1f90 cb51 a367 4f52 87e6  .........Q.gOR..
	0x0020:  8010 18dd fe28 0000 0101 080a 46a0 e014  .....(......F...
	0x0030:  46a0 e014                                F...
09:05:57.490685 IP localhost.49430 > localhost.http-alt: Flags [P.], seq 1544:2059, ack 887, win 6365, options [nop,nop,TS val 1184948260 ecr 1184948244], length 515: HTTP: GET / HTTP/1.1
	0x0000:  4500 0237 0000 4000 4006 0000 7f00 0001  E..7..@.@.......
	0x0010:  7f00 0001 c116 1f90 cb51 a367 4f52 87e6  .........Q.gOR..
	0x0020:  8018 18dd 002c 0000 0101 080a 46a0 e024  .....,......F..$
	0x0030:  46a0 e014 4745 5420 2f20 4854 5450 2f31  F...GET./.HTTP/1
```

Still unclear whether this is a Go HTTP header thing or a Go HTTP middleware thing or ... ?

**Comment by thisisaaronland** [comment]
But clearly there's something wrong in my code because this works fine:

https://github.com/aaronland/go-auth/blob/sessions/cmd/cookie-test/main.go

**Comment by straup** [comment]
If I replace the "next" redirect handler for the MFA signout handler then both cookies are unset.

```
   192 |
   193 |        fn := func(rsp http.ResponseWriter, req *http.Request) {
   194 |                log.Println("WTF")
   195 |                return
   196 |        }
   197 |
   198 |        h := http.HandlerFunc(fn)
   199 |
   200 |        // mfa_signout_handler := mfa_creds.SignoutHandler(auth_templates, "totp_signout", query_redirect_handler)
   201 |        mfa_signout_handler := mfa_creds.SignoutHandler(auth_templates, "totp_signout", h)
```
